id,description,brand,withdrawn_from_range,category,merged,unique_key,updated_at
82790015-5d0a-a001-11e7-56ff0e06dc2a,"""Запчасти для смесителей"" LM8700C Излив в сборе для LM1051C, хром",Lemark,True,Запчасти для смесителей,"""Запчасти для смесителей"" LM8700C Излив в сборе для LM1051C, хром | Brand: Lemark | Category: Запчасти для смесителей",,2025-03-28 12:56:02.352939+00:00
838f001c-c0e5-7ee7-11df-d1c6f644e33a,"""Запчасти для смесителей"" LM8526С Переключатель - дивертор кнопочный для ""Посейдон""",Lemark,True,Запчасти для смесителей,"""Запчасти для смесителей"" LM8526С Переключатель - дивертор кнопочный для ""Посейдон"" | Brand: Lemark | Category: Запчасти для смесителей",,2025-03-28 12:56:02.352939+00:00
82790015-5d0a-a001-11e7-57cc33911a15,"""Аксессуары"" LM8074CG Стойка душевая 810 мм с магнитным кронштейном, хром/зол, блистер",Lemark,True,Душ,"""Аксессуары"" LM8074CG Стойка душевая 810 мм с магнитным кронштейном, хром/зол, блистер | Brand: Lemark | Category: Душ",,2025-03-28 12:56:02.352939+00:00
846b0015-5d0a-a001-11eb-1359619d33f1,"""Эксперт"" LM5082S-Blue Смеситель для кухни, с гибким изливом и 2х-функциональным аэратором, сталь/си",Lemark,True,Смесители,"""Эксперт"" LM5082S-Blue Смеситель для кухни, с гибким изливом и 2х-функциональным аэратором, сталь/си | Brand: Lemark | Category: Смесители",,2025-03-28 12:56:02.352939+00:00
846b0015-5d0a-a001-11eb-0ec922d09a09,CN2008 Смеситель для душа,Cron,True,Смесители,CN2008 Смеситель для душа | Brand: Cron | Category: Смесители,,2025-03-28 12:56:02.352939+00:00
846b0015-5d0a-a001-11eb-03dca56bb880,"Смеситель для умывальника, Tring, Milardo, TRISB01M01",Milardo,True,Смесители,"Смеситель для умывальника, Tring, Milardo, TRISB01M01 | Brand: Milardo | Category: Смесители",,2025-03-28 12:56:02.352939+00:00
846b0015-5d0a-a001-11eb-0c7ac5c8f7e8,"Смеситель для ванны, черный, Ray, IDDIS, RAYBL02i02",IDDIS,True,Смесители,"Смеситель для ванны, черный, Ray, IDDIS, RAYBL02i02 | Brand: IDDIS | Category: Смесители",,2025-03-28 12:56:02.352939+00:00
846b0015-5d0a-a001-11eb-2960f9a39fc8,"HB70572 Смеситель для кухни с гайкой, хром",Haiba,True,Смесители,"HB70572 Смеситель для кухни с гайкой, хром | Brand: Haiba | Category: Смесители",,2025-03-28 11:57:34.404110+00:00
846b0015-5d0a-a001-11eb-298ec415ca59,HB70505 Смеситель для кухни (латунь),Haiba,True,Смесители,HB70505 Смеситель для кухни (латунь) | Brand: Haiba | Category: Смесители,-2.7607186039244547e+17,2025-03-28 10:10:51.104148+00:00
846b0015-5d0a-a001-11eb-298fa4c7a20a,"HB4101-2 Смеситель однорычажный для кухни с гайкой, хром",Haiba,True,Смесители,"HB4101-2 Смеситель однорычажный для кухни с гайкой, хром | Brand: Haiba | Category: Смесители",,2025-03-28 11:57:34.404110+00:00
846b0015-5d0a-a001-11eb-29900d5cc1f1,"HB4103-2 Смеситель однорычажный для кухни с гайкой, хром",Haiba,True,Смесители,"HB4103-2 Смеситель однорычажный для кухни с гайкой, хром | Brand: Haiba | Category: Смесители",,2025-03-28 11:57:34.404110+00:00
846b0015-5d0a-a001-11eb-2990ba22488f,HB4321 Смеситель однорычажный для кухни с допол. выходом для подключения фильтра питьевой воды хром,Haiba,True,Смесители,HB4321 Смеситель однорычажный для кухни с допол. выходом для подключения фильтра питьевой воды хром | Brand: Haiba | Category: Смесители,-5.88249226759235e+18,2025-03-28 10:10:51.104148+00:00
846b0015-5d0a-a001-11eb-30674bf0656e,Смеситель для ванны с душем ПРОФСАН ПСМ-301-1 STEEL нержавеющая сталь AISI-304 тип См-ВОРНШлА Черный,ПРОФСАН,True,Смесители,Смеситель для ванны с душем ПРОФСАН ПСМ-301-1 STEEL нержавеющая сталь AISI-304 тип См-ВОРНШлА Черный | Brand: ПРОФСАН | Category: Смесители,,2025-03-28 11:57:34.404110+00:00
846b0015-5d0a-a001-11eb-3079cee2e2e9,"Смеситель для кухни ПРОФСАН ЭЛИТ тип См-МОЦБА PSM-100-3 (с подводкой, картридж 35 мм)",ПРОФСАН,True,Смесители,"Смеситель для кухни ПРОФСАН ЭЛИТ тип См-МОЦБА PSM-100-3 (с подводкой, картридж 35 мм) | Brand: ПРОФСАН | Category: Смесители",,2025-03-28 11:57:34.404110+00:00
846b0015-5d0a-a001-11eb-1460790b0159,Полка угловая хром 2-ая W2672C-2,Аквалиния,True,Аксессуары для ванной комнаты,Полка угловая хром 2-ая W2672C-2 | Brand: Аквалиния | Category: Аксессуары для ванной комнаты,4.3898172254692347e+18,2025-03-28 10:10:51.104148+00:00
846b0015-5d0a-a001-11eb-0e12986998cd,"Умывальник мебельный, 40х20 см, 001, IDDIS/Milardo, 0014000U28 (тумба приобретается отдельно)",IDDIS,True,Мебель для ванной,"Умывальник мебельный, 40х20 см, 001, IDDIS/Milardo, 0014000U28 (тумба приобретается отдельно) | Brand: IDDIS | Category: Мебель для ванной",,2025-03-28 12:56:02.352939+00:00
846b0015-5d0a-a001-11eb-1ccba1522098,"Зеркало 80 см, Cloud, IDDIS, CLO8000i98",IDDIS,True,Мебель для ванной,"Зеркало 80 см, Cloud, IDDIS, CLO8000i98 | Brand: IDDIS | Category: Мебель для ванной",,2025-03-28 11:57:34.404110+00:00
846b0015-5d0a-a001-11eb-2335e5e11162,"Пенал подвесной, 40 см, Brick, белый, IDDIS, BRI40W0i97",IDDIS,True,Мебель для ванной,"Пенал подвесной, 40 см, Brick, белый, IDDIS, BRI40W0i97 | Brand: IDDIS | Category: Мебель для ванной",,2025-03-28 11:57:34.404110+00:00
846b0015-5d0a-a001-11eb-23379f3008bc,"Умывальник мебельный, 60 см, 010, IDDIS, 0106000i28",IDDIS,True,Мебель для ванной,"Умывальник мебельный, 60 см, 010, IDDIS, 0106000i28 | Brand: IDDIS | Category: Мебель для ванной",,2025-03-28 11:57:34.404110+00:00
846b0015-5d0a-a001-11eb-23387a9ced08,"Тумба подвесная, белая, 100 см, Brick, IDDIS, BRI10W1i95. Подходит умывальник: 0101000i28",IDDIS,True,Мебель для ванной,"Тумба подвесная, белая, 100 см, Brick, IDDIS, BRI10W1i95. Подходит умывальник: 0101000i28 | Brand: IDDIS | Category: Мебель для ванной",,2025-03-28 11:57:34.404110+00:00
846b0015-5d0a-a001-11eb-2338a3bc8649,"Умывальник мебельный, 100 см, 010, IDDIS, 0101000i28",IDDIS,True,Мебель для ванной,"Умывальник мебельный, 100 см, 010, IDDIS, 0101000i28 | Brand: IDDIS | Category: Мебель для ванной",,2025-03-28 11:57:34.404110+00:00
846b0015-5d0a-a001-11eb-233b87e3b1c5,"Зеркало 60 см, Cloud, IDDIS, CLO6000i98",IDDIS,True,Мебель для ванной,"Зеркало 60 см, Cloud, IDDIS, CLO6000i98 | Brand: IDDIS | Category: Мебель для ванной",,2025-03-28 11:57:34.404110+00:00
846b0015-5d0a-a001-11eb-1753d079c1d2,"""Черный металл"" Ерш сантехнический, черный B1034P-5",Аквалиния,True,Аксессуары для ванной комнаты,"""Черный металл"" Ерш сантехнический, черный B1034P-5 | Brand: Аквалиния | Category: Аксессуары для ванной комнаты",-6.20053783151572e+17,2025-03-28 10:10:51.104148+00:00
846b0015-5d0a-a001-11eb-27fce317c880,"Полка стеклянная с бортиком, стекло, сплав металлов, Cadiss Milardo, CADSMG0M44",Milardo,True,Аксессуары для ванной комнаты,"Полка стеклянная с бортиком, стекло, сплав металлов, Cadiss Milardo, CADSMG0M44 | Brand: Milardo | Category: Аксессуары для ванной комнаты",,2025-03-28 11:57:34.404110+00:00
846b0015-5d0a-a001-11eb-27fd19b9d07c,"Полотенцесушитель, сплав металлов, Cadiss, Milardo, CADSM10M49",Milardo,True,Аксессуары для ванной комнаты,"Полотенцесушитель, сплав металлов, Cadiss, Milardo, CADSM10M49 | Brand: Milardo | Category: Аксессуары для ванной комнаты",,2025-03-28 11:57:34.404110+00:00
846b0015-5d0a-a001-11eb-1ccb4c539ce0,"Умывальник мебельный, 80 см, 010, IDDIS, 0108000i28",IDDIS,True,Мебель для ванной,"Умывальник мебельный, 80 см, 010, IDDIS, 0108000i28 | Brand: IDDIS | Category: Мебель для ванной",,2025-03-28 11:57:34.404110+00:00
846b0015-5d0a-a001-11eb-23356472819c,"Зеркало 80 см, Brick, IDDIS, BRI8000i98",IDDIS,True,Мебель для ванной,"Зеркало 80 см, Brick, IDDIS, BRI8000i98 | Brand: IDDIS | Category: Мебель для ванной",,2025-03-28 11:57:34.404110+00:00
846b0015-5d0a-a001-11eb-2335a4b9cddd,"Зеркало 100 см, Brick, IDDIS, BRI1000i98",IDDIS,True,Мебель для ванной,"Зеркало 100 см, Brick, IDDIS, BRI1000i98 | Brand: IDDIS | Category: Мебель для ванной",,2025-03-28 11:57:34.404110+00:00
846b0015-5d0a-a001-11eb-233c1c361ec6,"Зеркало 100 см, Cloud, IDDIS, CLO1000i98",IDDIS,True,Мебель для ванной,"Зеркало 100 см, Cloud, IDDIS, CLO1000i98 | Brand: IDDIS | Category: Мебель для ванной",,2025-03-28 11:57:34.404110+00:00
846b0015-5d0a-a001-11eb-27db4b80e193,"Тумба подвесная, белый, 80 см, Edifice, IDDIS, EDI80W0i95. Подходит умывальник 0108000i28",IDDIS,True,Мебель для ванной,"Тумба подвесная, белый, 80 см, Edifice, IDDIS, EDI80W0i95. Подходит умывальник 0108000i28 | Brand: IDDIS | Category: Мебель для ванной",,2025-03-28 11:57:34.404110+00:00
86920027-0e37-9cfd-11e1-fd52bb97e128,"B35-51 Смеситель для биде, хром",Rossinka,True,Смесители,"B35-51 Смеситель для биде, хром | Brand: Rossinka | Category: Смесители",-2.9542683290082473e+18,2025-03-28 10:10:51.104148+00:00
8263001e-6749-51e8-11e7-444f48e9b099,HB54 Кран-букс для смесителей (переключатель в корпусе),Haiba,True,Запчасти для смесителей,HB54 Кран-букс для смесителей (переключатель в корпусе) | Brand: Haiba | Category: Запчасти для смесителей,,2025-03-28 12:47:09.146742+00:00
846b0015-5d0a-a001-11eb-306cf2f8c8f7,Душевая система ПРОФСАН ПСМ-300-8 STEEL нержавеющая сталь AISI-304 тип См-ВДшОРНТрА PSM-300-8 (евро,ПРОФСАН,True,Душ,Душевая система ПРОФСАН ПСМ-300-8 STEEL нержавеющая сталь AISI-304 тип См-ВДшОРНТрА PSM-300-8 (евро | Brand: ПРОФСАН | Category: Душ,,2025-03-28 11:57:34.404110+00:00
86920027-0e37-9cfd-11e2-021058a26c50,"""Запчасти для смесителей"" LM8553С Переключатель - дивертор для ""Юнит"" LM4502C",Lemark,True,Запчасти для смесителей,"""Запчасти для смесителей"" LM8553С Переключатель - дивертор для ""Юнит"" LM4502C | Brand: Lemark | Category: Запчасти для смесителей",8.4361752183882e+18,2025-03-28 10:10:51.104148+00:00
86060015-5d0a-a001-11eb-ba143d6adf2a,Душевая система со смесителем AVRORA Logo AV3440,Avrora,True,Душ,Душевая система со смесителем AVRORA Logo AV3440 | Brand: Avrora | Category: Душ,-5.262659513710413e+18,2025-03-28 10:10:51.104148+00:00
86f8001e-6749-51e8-11e5-2a01aed4ba4a,"DA1424701D08 Душевая стойка, хром",D&K,True,Душ,"DA1424701D08 Душевая стойка, хром | Brand: D&K | Category: Душ",8.574797086267114e+18,2025-03-28 10:10:51.104148+00:00
8aef0015-5d3c-8c01-11ec-d6685118a906,"""Аксессуары"" LM8123BL Лейка душевая 3-функциональная 80х260 мм, черный",Lemark,True,Душ,"""Аксессуары"" LM8123BL Лейка душевая 3-функциональная 80х260 мм, черный | Brand: Lemark | Category: Душ",-6.776314323313058e+18,2025-03-28 10:10:51.104148+00:00
846b0015-5d0a-a001-11eb-233f5f7a1f41,"Смеситель для душа, YA33177C, Vane, комплектный",IDDIS,True,Смесители,"Смеситель для душа, YA33177C, Vane, комплектный | Brand: IDDIS | Category: Смесители",-2.4528391983240325e+18,2025-03-28 10:10:51.104148+00:00
8aa70015-5d0a-a001-11e9-3e7c8ba28fc4,"""Drop"" Подставка д/зубн. щеток пластик голубой B0458-3",Аквалиния,True,Аксессуары для ванной комнаты,"""Drop"" Подставка д/зубн. щеток пластик голубой B0458-3 | Brand: Аквалиния | Category: Аксессуары для ванной комнаты",-3.51328108818624e+18,2025-03-28 10:10:51.104148+00:00
86060015-5d0a-a001-11eb-9b6628aee944,"DA1432126 Смеситель для раковины, белый матовый",D&K,True,Смесители,"DA1432126 Смеситель для раковины, белый матовый | Brand: D&K | Category: Смесители",-4.803169019080862e+18,2025-03-28 10:10:51.104148+00:00
86060015-5d0a-a001-11eb-ba1232a49d5b,Смеситель для кухни AVRORA Line AV3121 с высоким поворотным изливом,Avrora,True,Смесители,Смеситель для кухни AVRORA Line AV3121 с высоким поворотным изливом | Brand: Avrora | Category: Смесители,-3.46593627916596e+17,2025-03-28 10:10:51.104148+00:00
86060015-5d0a-a001-11eb-ba12a2a6d861,Смеситель для кухни AVRORA Elite AV3221 с высоким поворотным изливом в матовом черном цвете,Avrora,True,Смесители,Смеситель для кухни AVRORA Elite AV3221 с высоким поворотным изливом в матовом черном цвете | Brand: Avrora | Category: Смесители,-8.169833389153175e+18,2025-03-28 10:10:51.104148+00:00
86060015-5d0a-a001-11eb-ba12b89589f1,Смеситель для ванны AVRORA Elite AV3231 с коротким изливом в матовом черном цвете,Avrora,True,Смесители,Смеситель для ванны AVRORA Elite AV3231 с коротким изливом в матовом черном цвете | Brand: Avrora | Category: Смесители,-8.194986207997144e+18,2025-03-28 10:10:51.104148+00:00
86060015-5d0a-a001-11eb-ba130354c2b2,Смеситель для кухни AVRORA Pulse AV2021 с высоким поворотным изливом,Avrora,True,Смесители,Смеситель для кухни AVRORA Pulse AV2021 с высоким поворотным изливом | Brand: Avrora | Category: Смесители,-8.538865381379275e+18,2025-03-28 10:10:51.104148+00:00
86060015-5d0a-a001-11eb-ba134f10c240,Смеситель для умывальника AVRORA Mirro AV3310 монолитный,Avrora,True,Смесители,Смеситель для умывальника AVRORA Mirro AV3310 монолитный | Brand: Avrora | Category: Смесители,-8.971355166696438e+18,2025-03-28 10:10:51.104148+00:00
86060015-5d0a-a001-11eb-ba136316a8ea,Смеситель для кухни AVRORA Mirro AV3320 с низким поворотным изливом,Avrora,True,Смесители,Смеситель для кухни AVRORA Mirro AV3320 с низким поворотным изливом | Brand: Avrora | Category: Смесители,-8.148439014828782e+18,2025-03-28 10:10:51.104148+00:00
86060015-5d0a-a001-11eb-ba138c9b35f8,Смеситель для кухни AVRORA Mirro AV3321 с высоким поворотным изливом,Avrora,True,Смесители,Смеситель для кухни AVRORA Mirro AV3321 с высоким поворотным изливом | Brand: Avrora | Category: Смесители,5.926950216028236e+18,2025-03-28 10:10:51.104148+00:00
86060015-5d0a-a001-11eb-ba13e873eac4,Смеситель для умывальника AVRORA Logo AV3412 высокий монолитный,Avrora,True,Смесители,Смеситель для умывальника AVRORA Logo AV3412 высокий монолитный | Brand: Avrora | Category: Смесители,8.175353503650994e+17,2025-03-28 10:10:51.104148+00:00
86060015-5d0a-a001-11eb-ba14002552f4,Смеситель для кухни AVRORA Logo AV3421 с высоким поворотным изливом,Avrora,True,Смесители,Смеситель для кухни AVRORA Logo AV3421 с высоким поворотным изливом | Brand: Avrora | Category: Смесители,7.603563829780528e+18,2025-03-28 10:10:51.104148+00:00
86060015-5d0a-a001-11eb-ba14282c9856,Смеситель для ванны AVRORA Logo AV3431 с коротким изливом,Avrora,True,Смесители,Смеситель для ванны AVRORA Logo AV3431 с коротким изливом | Brand: Avrora | Category: Смесители,7.376690555463247e+18,2025-03-28 10:10:51.104148+00:00
86060015-5d0a-a001-11eb-bc5877ebde92,"RS50-52 Смеситель термостатический с гигиеническим душем, хром",Rossinka,True,Смесители,"RS50-52 Смеситель термостатический с гигиеническим душем, хром | Brand: Rossinka | Category: Смесители",-6.591472110261516e+18,2025-03-28 10:10:51.104148+00:00
8a610015-5d0a-a001-11e9-b1da21439b04,"HB10589 Смеситель однорычажный для раковины, хром",Haiba,True,Смесители,"HB10589 Смеситель однорычажный для раковины, хром | Brand: Haiba | Category: Смесители",-6.568833215453783e+18,2025-03-28 10:10:51.104148+00:00
8a610015-5d0a-a001-11e9-b1da955d44ca,HB70505-8 Смеситель для кухни (латунь) белый/хром,Haiba,True,Смесители,HB70505-8 Смеситель для кухни (латунь) белый/хром | Brand: Haiba | Category: Смесители,-4.732437371734243e+18,2025-03-28 10:10:51.104148+00:00
8aa70015-5d0a-a001-11e9-3fdd8ee4646e,"""Контест"" LM5819CW Смеситель с гигиеническим душем, встраиваемый, хром/белый",Lemark,True,Смесители,"""Контест"" LM5819CW Смеситель с гигиеническим душем, встраиваемый, хром/белый | Brand: Lemark | Category: Смесители",-4.5149804054998195e+18,2025-03-28 10:10:51.104148+00:00
846b0015-5d0a-a001-11eb-3305e9ca1044,"""Alien"" Дозатор для ж/мыла керамика CE1727AA-LD",Аквалиния,True,Аксессуары для ванной комнаты,"""Alien"" Дозатор для ж/мыла керамика CE1727AA-LD | Brand: Аквалиния | Category: Аксессуары для ванной комнаты",-1.3108152084381258e+18,2025-03-28 10:10:51.104148+00:00
846b0015-5d0a-a001-11eb-3307d460c119,"""Soft Мокачино"" Дозатор для ж/мыла керамика B4333A-1М",Аквалиния,True,Аксессуары для ванной комнаты,"""Soft Мокачино"" Дозатор для ж/мыла керамика B4333A-1М | Brand: Аквалиния | Category: Аксессуары для ванной комнаты",-3.1245384205479183e+18,2025-03-28 10:10:51.104148+00:00
8aa70015-5d0a-a001-11e9-3e771da2fa2d,"""Drop"" Дозатор для ж/мыла пластик голубой B0458-1",Аквалиния,True,Аксессуары для ванной комнаты,"""Drop"" Дозатор для ж/мыла пластик голубой B0458-1 | Brand: Аквалиния | Category: Аксессуары для ванной комнаты",-1.1507163548904219e+18,2025-03-28 10:10:51.104148+00:00
8aef0015-5d3c-8c01-11ec-e88c463b5eba,"""Дебби"" Дозатор для ж/мыла керамика CE3034AA-LD",Аквалиния,True,Аксессуары для ванной комнаты,"""Дебби"" Дозатор для ж/мыла керамика CE3034AA-LD | Brand: Аквалиния | Category: Аксессуары для ванной комнаты",-4.921820539907846e+18,2025-03-28 10:10:51.104148+00:00
8aef0015-5d3c-8c01-11ec-e895443e51c3,"""VINTAGE"" Коврик для ванной 1-ый Fixsen, FX-7000A, бежевый, 70х80 см",Fixsen,True,Аксессуары для ванной комнаты,"""VINTAGE"" Коврик для ванной 1-ый Fixsen, FX-7000A, бежевый, 70х80 см | Brand: Fixsen | Category: Аксессуары для ванной комнаты",-8.057909835719e+18,2025-03-28 10:10:51.104148+00:00
8aef0015-5d3c-8c01-11ec-e895c1cb58e3,"""VINTAGE"" Коврик для ванной 1-ый Fixsen VINTAGE, FX-7000R, красный, 50х80 см",Fixsen,True,Аксессуары для ванной комнаты,"""VINTAGE"" Коврик для ванной 1-ый Fixsen VINTAGE, FX-7000R, красный, 50х80 см | Brand: Fixsen | Category: Аксессуары для ванной комнаты",-7.835913079313793e+18,2025-03-28 10:10:51.104148+00:00
86060015-5d0a-a001-11eb-983ad5526123,"IZEO 60 комплект мебели подвесной c дверцами (тумба + раковина Енисей), дуб сонома IZ-T60DS2",Garda,True,Мебель для ванной,"IZEO 60 комплект мебели подвесной c дверцами (тумба + раковина Енисей), дуб сонома IZ-T60DS2 | Brand: Garda | Category: Мебель для ванной",-7.175430668483495e+18,2025-03-28 10:10:51.104148+00:00
8aef0015-5d3c-8c01-11ec-a5e52f99121d,"NEMI 60 Зеркало шкаф  цвет Серый, Белый NM-ZH60GR/W",Garda,True,Мебель для ванной,"NEMI 60 Зеркало шкаф  цвет Серый, Белый NM-ZH60GR/W | Brand: Garda | Category: Мебель для ванной",-1.15661971173187e+18,2025-03-28 10:10:51.104148+00:00
8aef0015-5d3c-8c01-11ec-a121273b78f5,"Тумба IZEO 60 подвесная с дверцами (БЕЗ СБОРКИ), цвет белый",Garda,True,Комплектующие для мебели,"Тумба IZEO 60 подвесная с дверцами (БЕЗ СБОРКИ), цвет белый | Brand: Garda | Category: Комплектующие для мебели",-8.549196903709332e+18,2025-03-28 10:10:51.104148+00:00
8aef0015-5d3c-8c01-11ec-a1223423f9b5,"Тумба IZEO 60 подвесная с дверцами, цвет Дуб Крафт золотой IZ-T60K/PW2 (тумба)",Garda,True,Комплектующие для мебели,"Тумба IZEO 60 подвесная с дверцами, цвет Дуб Крафт золотой IZ-T60K/PW2 (тумба) | Brand: Garda | Category: Комплектующие для мебели",-2.2410545726587712e+18,2025-03-28 10:10:51.104148+00:00
8aef0015-5d3c-8c01-11ec-ed6d80c7262d,"Тумба DELLA 60 подвесная, цвет Дуб крафт золотой DL-T60K/PW",Garda,True,Комплектующие для мебели,"Тумба DELLA 60 подвесная, цвет Дуб крафт золотой DL-T60K/PW | Brand: Garda | Category: Комплектующие для мебели",1.6172894181824778e+18,2025-03-28 10:10:51.104148+00:00
8aef0015-5d3c-8c01-11ec-fc4c305f6594,"Фасады к тумбе BELLAGIO 75 (согл.эскиза), Белый глянец DM101-6T",,True,Комплектующие для мебели,"Фасады к тумбе BELLAGIO 75 (согл.эскиза), Белый глянец DM101-6T | Brand:  | Category: Комплектующие для мебели",2.5522633181213978e+17,2025-03-28 10:10:51.104148+00:00
